{
  "skill": {
    "name": "example-skill",
    "description": "Describe the skill in the same user-facing terms that `SKILL.md` frontmatter will need later.",
    "version": "0.1.0"
  },
  "authoring": {
    "singleJob": "Describe one repeatable skill workflow and stop at Eval Brief ready.",
    "triggerBoundary": {
      "shouldTriggerWhen": [
        "Request asks to create or refactor one reusable skill"
      ],
      "shouldNotTriggerWhen": [
        "Task is repository policy or AGENTS maintenance",
        "Task starts from a finished Eval Brief and asks for downstream eval authoring",
        "Task is shared eval runtime implementation"
      ],
      "stopConditions": [
        "Skill target is unclear",
        "More than one workflow is requested",
        "No stable source references available"
      ]
    }
  },
  "successModel": {
    "outcomeGoals": [
      "Skill output boundary is explicit"
    ],
    "boundaryGoals": [
      "Request routes cleanly to trigger, non-trigger, or stop-and-ask"
    ],
    "styleGoals": [
      "Procedural and concise instructions"
    ],
    "efficiencyGoals": [
      "No duplicated runtime harness"
    ],
    "definitionOfDone": [
      "Eval Brief ready"
    ],
    "nonGoals": [
      "Implement eval runtime behavior",
      "Write concrete downstream eval cases in this step"
    ]
  },
  "activationProbes": [
    {
      "id": "probe-explicit-1",
      "kind": "explicit",
      "prompt": "Create one reusable skill from this request",
      "expectedSignal": "Workflow is scoped and contract-first"
    }
  ],
  "seedEvalIntent": {
    "mustStopAt": "Eval Brief ready",
    "comparisonFocus": [
      "Requests that should trigger skill authoring",
      "Nearby requests that should not trigger skill authoring"
    ],
    "notes": [
      "This artifact carries authoring intent only",
      "Downstream eval authoring turns this into Promptfoo-native suite cases under evals/engines/promptfoo/tests/"
    ]
  },
  "negativeSignals": [
    "Asks for shared eval runtime implementation",
    "Starts from a finished Eval Brief and asks for eval authoring"
  ],
  "sourceRefs": [
    "packs/core/<target-skill>/SKILL.md",
    "<path-to-domain-or-source-material>.md"
  ]
}
