{
  "skill": {
    "name": "example-skill",
    "description": "Defines one reusable skill contract before implementation. Use when the task is contract authoring for a single skill. Do not use for runtime implementation, downstream eval authoring, or repository policy work.",
    "version": "0.1.0"
  },
  "authoring": {
    "singleJob": "Describe one repeatable skill workflow and stop at Eval Brief ready.",
    "packageShape": {
      "requiredFiles": [
        "SKILL.md"
      ],
      "supportFolders": []
    },
    "triggerBoundary": {
      "shouldTriggerWhen": [
        "Request asks to create or refactor one reusable skill"
      ],
      "shouldNotTriggerWhen": [
        "Task is repository policy or AGENTS maintenance",
        "Task starts from a finished Eval Brief and asks for downstream eval authoring",
        "Task is shared eval runtime implementation"
      ],
      "stopConditions": [
        "Skill target is unclear",
        "More than one workflow is requested",
        "The brief cannot yet carry enough portable authority to hand off safely"
      ]
    }
  },
  "successModel": {
    "outcomeGoals": [
      "Skill output boundary is explicit"
    ],
    "boundaryGoals": [
      "Request routes cleanly to trigger, non-trigger, or stop-and-ask"
    ],
    "styleGoals": [
      "Procedural and concise instructions"
    ],
    "efficiencyGoals": [
      "No duplicated runtime harness"
    ],
    "definitionOfDone": [
      "Eval Brief ready"
    ],
    "nonGoals": [
      "Implement eval runtime behavior",
      "Write concrete downstream eval cases in this step"
    ]
  },
  "activationProbes": [
    {
      "id": "probe-explicit-1",
      "kind": "explicit",
      "prompt": "Create one reusable skill from this request",
      "expectedSignal": "Workflow is scoped and contract-first"
    },
    {
      "id": "probe-explicit-2",
      "kind": "explicit",
      "prompt": "Refactor one named existing skill by freezing its contract first",
      "expectedSignal": "Existing-skill refactor routes to contract-first work"
    }
  ],
  "seedEvalIntent": {
    "mustStopAt": "Eval Brief ready",
    "comparisonFocus": [
      "Requests that should trigger skill authoring",
      "Nearby requests that should not trigger skill authoring",
      "At least one ambiguity or stop-and-ask edge near the skill boundary"
    ],
    "notes": [
      "This artifact carries authoring intent only",
      "Prefer a tiny high-signal set of representative triggers and nearby negatives instead of padded lists",
      "Downstream eval authoring turns this into Promptfoo-native suite cases under evals/engines/promptfoo/tests/"
    ]
  },
  "negativeSignals": [
    "Asks for shared eval runtime implementation",
    "Starts from a finished Eval Brief and asks for eval authoring"
  ],
  "sourceRefs": []
}
